{
  "$schema": "https://json-schema.org/draft/2020-12/schema",
  "$id": "https://qijenchen.dev/schemas/external-activation-policy-v1.json",
  "title": "Immutable external activation requirement catalog",
  "type": "object",
  "additionalProperties": false,
  "required": ["$schema", "schemaVersion", "policyId", "activeProfile", "profiles", "requirements"],
  "properties": {
    "$schema": {"const": "schemas/external-activation-policy.schema.json"},
    "schemaVersion": {"const": 1},
    "policyId": {"const": "ds-external-activation-v1"},
    "activeProfile": {
      "enum": [
        "PRODUCTION_GRADE_SINGLE_OWNER_SMALL_TEAM",
        "MAXIMUM_ASSURANCE_MULTI_CUSTODIAN_WORM"
      ]
    },
    "profiles": {
      "type": "array",
      "minItems": 2,
      "maxItems": 2,
      "uniqueItems": true,
      "items": {"$ref": "#/$defs/assuranceProfile"}
    },
    "requirements": {
      "type": "array",
      "minItems": 1,
      "items": {"$ref": "#/$defs/requirement"}
    }
  },
  "$defs": {
    "assuranceProfile": {
      "type": "object",
      "additionalProperties": false,
      "required": ["id", "releaseAuthorization", "requiredRequirementIdsByScope"],
      "properties": {
        "id": {
          "enum": [
            "PRODUCTION_GRADE_SINGLE_OWNER_SMALL_TEAM",
            "MAXIMUM_ASSURANCE_MULTI_CUSTODIAN_WORM"
          ]
        },
        "releaseAuthorization": {
          "$ref": "#/$defs/releaseAuthorization"
        },
        "requiredRequirementIdsByScope": {
          "type": "object",
          "additionalProperties": false,
          "required": ["release", "fleet-rollout", "managed-host", "objective-completion"],
          "properties": {
            "release": {"$ref": "#/$defs/requirementIdSet"},
            "fleet-rollout": {"$ref": "#/$defs/requirementIdSet"},
            "managed-host": {"$ref": "#/$defs/requirementIdSet"},
            "objective-completion": {"$ref": "#/$defs/requirementIdSet"}
          }
        }
      }
    },
    "releaseAuthorization": {
      "type": "object",
      "additionalProperties": false,
      "required": ["minimumSignerQuorum", "maximumSignerQuorum"],
      "properties": {
        "minimumSignerQuorum": {"type": "integer", "minimum": 1, "maximum": 5},
        "maximumSignerQuorum": {"type": "integer", "minimum": 1, "maximum": 5}
      }
    },
    "requirementIdSet": {
      "type": "array",
      "uniqueItems": true,
      "items": {"type": "string", "pattern": "^[a-z0-9][a-z0-9-]*$"}
    },
    "requirement": {
      "type": "object",
      "additionalProperties": false,
      "required": ["id", "kind", "repository", "desiredPath", "requiredFor", "condition", "reason", "evidenceContract"],
      "properties": {
        "id": {"type": "string", "pattern": "^[a-z0-9][a-z0-9-]*$"},
        "kind": {
          "enum": [
            "github-app", "protected-environment", "github-repository", "github-token-permission",
            "github-mutation-boundary",
            "managed-host-policy", "release-authorization", "npm-package-identity",
            "npm-trusted-publisher", "npm-publishing-access", "durable-evidence-mirror", "rollback-drill",
            "managed-ci-attestation"
          ]
        },
        "repository": {"type": "string", "pattern": "^[A-Za-z0-9_.-]+/[A-Za-z0-9_.-]+$"},
        "desiredPath": {"type": "string", "minLength": 1},
        "requiredFor": {
          "type": "array", "minItems": 1, "uniqueItems": true,
          "items": {"enum": ["release", "fleet-rollout", "managed-host", "objective-completion"]}
        },
        "condition": {"type": "string", "minLength": 1},
        "reason": {"type": "string", "minLength": 1},
        "packageName": {"type": "string", "pattern": "^@[a-z0-9][a-z0-9._-]*/[a-z0-9][a-z0-9._-]*$"},
        "registry": {"const": "https://registry.npmjs.org"},
        "bootstrap": {"$ref": "#/$defs/bootstrap"},
        "trustedPublisher": {"$ref": "#/$defs/trustedPublisher"},
        "publishingAccess": {"$ref": "#/$defs/publishingAccess"},
        "mutationBoundaryContract": {"$ref": "#/$defs/mutationBoundaryContract"},
        "managedCiBindingContract": {"$ref": "#/$defs/managedCiBindingContract"},
        "evidenceContract": {
          "type": "object", "additionalProperties": false,
          "required": ["kind", "requiredClaimKeys"],
          "properties": {
            "kind": {"enum": ["github-api-readback", "npm-registry-readback", "endpoint-management-readback", "signed-operator-bundle"]},
            "requiredClaimKeys": {
              "type": "array", "minItems": 1, "uniqueItems": true,
              "items": {"type": "string", "pattern": "^[A-Za-z][A-Za-z0-9]*$"}
            }
          }
        }
      },
      "allOf": [
        {
          "if": {"properties": {"kind": {"const": "npm-package-identity"}}, "required": ["kind"]},
          "then": {"required": ["packageName", "registry", "bootstrap"], "properties": {"packageName": true, "registry": true, "bootstrap": true}}
        },
        {
          "if": {"properties": {"kind": {"const": "npm-trusted-publisher"}}, "required": ["kind"]},
          "then": {"required": ["packageName", "registry", "trustedPublisher"], "properties": {"packageName": true, "registry": true, "trustedPublisher": true}}
        },
        {
          "if": {"properties": {"kind": {"const": "npm-publishing-access"}}, "required": ["kind"]},
          "then": {"required": ["packageName", "registry", "publishingAccess"], "properties": {"packageName": true, "registry": true, "publishingAccess": true}}
        },
        {
          "if": {"properties": {"kind": {"const": "github-mutation-boundary"}}, "required": ["kind"]},
          "then": {"required": ["mutationBoundaryContract"], "properties": {"mutationBoundaryContract": true}},
          "else": {"not": {"required": ["mutationBoundaryContract"]}}
        },
        {
          "if": {"properties": {"kind": {"const": "managed-ci-attestation"}}, "required": ["kind"]},
          "then": {"required": ["managedCiBindingContract"], "properties": {"managedCiBindingContract": true}},
          "else": {"not": {"required": ["managedCiBindingContract"]}}
        }
      ]
    },
    "mutationBoundaryContract": {
      "type": "object",
      "additionalProperties": false,
      "required": ["path", "sha256"],
      "properties": {
        "path": {"const": "infra/governance/providers/github-mutation-boundary-contract.json"},
        "sha256": {"type": "string", "pattern": "^[a-f0-9]{64}$"}
      }
    },
    "managedCiBindingContract": {
      "type": "object",
      "additionalProperties": false,
      "required": [
        "canonicalSerialization",
        "provenanceProjection",
        "receiptBindingProjection",
        "oidcClaimProjection",
        "oidcBindingProjection",
        "oidcSubjectReadback",
        "secretBrokerPolicyBinding",
        "imageSupplyChainProjection",
        "frozenSubjectArtifactProjection",
        "hostSandboxPolicyProjection",
        "hostSandboxReadbackProjection",
        "receiptSignerAuthorityProjection",
        "rawReceiptValidationProjection",
        "receiptSigningPayloadProjection",
        "receiptSignerAuditProjection",
        "finalizationProtocolProjection",
        "finalizationTransportProjection",
        "modelReleaseAuthorityProjection",
        "readbackBindingProjection",
        "rawEvidenceAuthority"
      ],
      "properties": {
        "canonicalSerialization": {"const": "stable-json-sha256"},
        "provenanceProjection": {"const": "managed-ci-full-provenance-v2"},
        "receiptBindingProjection": {"const": "managed-ci-execution-class-receipt-binding-v1"},
        "oidcClaimProjection": {"const": "github-actions-oidc-exact-claims-v1"},
        "oidcBindingProjection": {"const": "managed-ci-execution-class-oidc-binding-v1"},
        "oidcSubjectReadback": {"const": "github-actions-immutable-default-subject-v1"},
        "secretBrokerPolicyBinding": {"const": "managed-ci-secret-broker-policy-v1"},
        "imageSupplyChainProjection": {"const": "managed-ci-image-supply-chain-binding-v2"},
        "frozenSubjectArtifactProjection": {"const": "managed-ci-frozen-subject-v1"},
        "hostSandboxPolicyProjection": {"const": "managed-ci-host-sandbox-policy-binding-v1"},
        "hostSandboxReadbackProjection": {"const": "managed-ci-host-sandbox-independent-observation-v1"},
        "receiptSignerAuthorityProjection": {"const": "managed-ci-receipt-signer-authority-binding-v1"},
        "rawReceiptValidationProjection": {"const": "managed-ci-raw-receipt-validation-readback-v1"},
        "receiptSigningPayloadProjection": {"const": "managed-ci-finalized-receipt-v1"},
        "receiptSignerAuditProjection": {"const": "managed-ci-signer-audit-event-v1"},
        "finalizationProtocolProjection": {"const": "managed-ci-authority-finalization-protocol-v1"},
        "finalizationTransportProjection": {"const": "managed-ci-finalization-transport-readback-v1"},
        "modelReleaseAuthorityProjection": {"const": "managed-ci-model-release-authority-binding-v1"},
        "readbackBindingProjection": {"const": "managed-ci-attested-readback-v1"},
        "rawEvidenceAuthority": {"const": "signed-independent-completion-attestor-readback"}
      }
    },
    "bootstrap": {
      "type": "object",
      "additionalProperties": false,
      "required": ["whenMissing", "releaseVersionSource", "consumerEligible"],
      "properties": {
        "whenMissing": {"const": "interactive-2fa-lower-non-consumed-version"},
        "releaseVersionSource": {"type": "string", "pattern": "^packages/[a-z0-9][a-z0-9-]*/package\\.json#/version$"},
        "consumerEligible": {"const": false}
      }
    },
    "trustedPublisher": {
      "type": "object",
      "additionalProperties": false,
      "required": ["provider", "repository", "workflow", "environment", "allowedActions", "directPublishAllowed", "exclusive"],
      "properties": {
        "provider": {"const": "github-actions"},
        "repository": {"const": "ajenchen/design-system"},
        "workflow": {"const": ".github/workflows/release.yml"},
        "environment": {"const": "npm-release"},
        "allowedActions": {
          "type": "array",
          "prefixItems": [{"const": "npm stage publish"}],
          "items": false,
          "minItems": 1,
          "maxItems": 1
        },
        "directPublishAllowed": {"const": false},
        "exclusive": {"const": true}
      }
    },
    "publishingAccess": {
      "type": "object",
      "additionalProperties": false,
      "required": ["twoFactorMode", "tokensAllowed", "tokenClassesToRemove"],
      "properties": {
        "twoFactorMode": {"const": "require-2fa-and-disallow-tokens"},
        "tokensAllowed": {"const": false},
        "tokenClassesToRemove": {
          "type": "array",
          "minItems": 4,
          "maxItems": 4,
          "uniqueItems": true,
          "items": {"enum": ["classic", "granular", "automation", "bypass-2fa"]}
        }
      }
    }
  }
}
