{
  "$schema": "schemas/external-activation-policy.schema.json",
  "schemaVersion": 1,
  "policyId": "ds-external-activation-v1",
  "activeProfile": "PRODUCTION_GRADE_SINGLE_OWNER_SMALL_TEAM",
  "profiles": [
    {
      "id": "PRODUCTION_GRADE_SINGLE_OWNER_SMALL_TEAM",
      "releaseAuthorization": {
        "minimumSignerQuorum": 1,
        "maximumSignerQuorum": 1
      },
      "requiredRequirementIdsByScope": {
        "release": [
          "resolve-governance-app-identities",
          "activate-independent-finalizer-signed-authority",
          "activate-managed-release-trust",
          "grant-read-only-preflight-observation",
          "activate-design-system-mirror-mutation-boundary",
          "activate-product-template-mirror-mutation-boundary",
          "activate-independent-release-tag-authorizers",
          "activate-npm-design-system-package-identity",
          "activate-npm-storybook-config-package-identity",
          "bootstrap-npm-governance-package-identity",
          "activate-design-system-stage-only-trusted-publisher",
          "activate-storybook-config-stage-only-trusted-publisher",
          "activate-governance-stage-only-trusted-publisher",
          "enforce-design-system-tokenless-2fa-publishing",
          "enforce-storybook-config-tokenless-2fa-publishing",
          "enforce-governance-tokenless-2fa-publishing"
        ],
        "fleet-rollout": [
          "resolve-governance-app-identities",
          "activate-managed-release-trust",
          "activate-independent-release-tag-authorizers"
        ],
        "managed-host": [],
        "objective-completion": [
          "resolve-governance-app-identities",
          "activate-independent-finalizer-signed-authority",
          "activate-managed-release-trust",
          "grant-read-only-preflight-observation",
          "activate-design-system-mirror-mutation-boundary",
          "activate-product-template-mirror-mutation-boundary",
          "activate-independent-release-tag-authorizers",
          "activate-npm-design-system-package-identity",
          "activate-npm-storybook-config-package-identity",
          "bootstrap-npm-governance-package-identity",
          "activate-design-system-stage-only-trusted-publisher",
          "activate-storybook-config-stage-only-trusted-publisher",
          "activate-governance-stage-only-trusted-publisher",
          "enforce-design-system-tokenless-2fa-publishing",
          "enforce-storybook-config-tokenless-2fa-publishing",
          "enforce-governance-tokenless-2fa-publishing"
        ]
      }
    },
    {
      "id": "MAXIMUM_ASSURANCE_MULTI_CUSTODIAN_WORM",
      "releaseAuthorization": {
        "minimumSignerQuorum": 2,
        "maximumSignerQuorum": 5
      },
      "requiredRequirementIdsByScope": {
        "release": [
          "resolve-governance-app-identities",
          "activate-independent-finalizer-signed-authority",
          "activate-managed-release-trust",
          "grant-read-only-preflight-observation",
          "activate-design-system-mirror-mutation-boundary",
          "activate-product-template-mirror-mutation-boundary",
          "activate-independent-release-tag-authorizers",
          "activate-npm-design-system-package-identity",
          "activate-npm-storybook-config-package-identity",
          "bootstrap-npm-governance-package-identity",
          "activate-design-system-stage-only-trusted-publisher",
          "activate-storybook-config-stage-only-trusted-publisher",
          "activate-governance-stage-only-trusted-publisher",
          "enforce-design-system-tokenless-2fa-publishing",
          "enforce-storybook-config-tokenless-2fa-publishing",
          "enforce-governance-tokenless-2fa-publishing",
          "activate-off-host-append-only-reconcile-evidence-mirror",
          "activate-managed-ci-trusted-execution"
        ],
        "fleet-rollout": [
          "resolve-governance-app-identities",
          "activate-managed-release-trust",
          "activate-independent-release-tag-authorizers",
          "activate-off-host-append-only-reconcile-evidence-mirror",
          "activate-managed-ci-trusted-execution",
          "complete-real-fleet-rollback-drill"
        ],
        "managed-host": [
          "activate-claude-managed-host-assurance",
          "activate-codex-managed-host-assurance"
        ],
        "objective-completion": [
          "resolve-governance-app-identities",
          "activate-independent-finalizer-signed-authority",
          "activate-managed-release-trust",
          "grant-read-only-preflight-observation",
          "activate-design-system-mirror-mutation-boundary",
          "activate-product-template-mirror-mutation-boundary",
          "activate-claude-managed-host-assurance",
          "activate-codex-managed-host-assurance",
          "activate-independent-release-tag-authorizers",
          "activate-npm-design-system-package-identity",
          "activate-npm-storybook-config-package-identity",
          "bootstrap-npm-governance-package-identity",
          "activate-design-system-stage-only-trusted-publisher",
          "activate-storybook-config-stage-only-trusted-publisher",
          "activate-governance-stage-only-trusted-publisher",
          "enforce-design-system-tokenless-2fa-publishing",
          "enforce-storybook-config-tokenless-2fa-publishing",
          "enforce-governance-tokenless-2fa-publishing",
          "activate-off-host-append-only-reconcile-evidence-mirror",
          "activate-managed-ci-trusted-execution",
          "complete-real-fleet-rollback-drill"
        ]
      }
    }
  ],
  "requirements": [
    {
      "id": "resolve-governance-app-identities",
      "kind": "github-app",
      "repository": "ajenchen/design-system",
      "desiredPath": "infra/governance/desired/github.json#/integrations",
      "requiredFor": [
        "release",
        "fleet-rollout",
        "objective-completion"
      ],
      "condition": "First pin the exact positive numeric IDs, selected-repository mode, and closed least-privilege permission maps for both governance Apps in immutable desired state. Install the Check App on every required-check repository and the Writer App on exactly the authority external-ledger target plus every template/consumer mutation target. Route authority governance-mirror credentials only to the exact template-mirror, authority governance-external-ledger credentials only to the authority repository itself, and each template/consumer governance-upgrade credential only to its own repository. Keep ID/private-key secrets in the exact named environments, prove repository/org governance-secret fallbacks are canonically empty, and complete a credential-environment-to-target installation token-mint/capability/permission probe. The signed observation must be no older than 3600 seconds.",
      "reason": "Rulesets, protected Check App verdicts, Writer App-authored propagation PRs, and protected external-ledger writes cannot be bound to unresolved or substituted App identities, wrong credential-to-target routes, overprivileged or all-repository App registrations, missing or extra installations, misplaced fallback secrets, secret metadata without working values, or stale hidden-state observations.",
      "evidenceContract": {
        "kind": "github-api-readback",
        "requiredClaimKeys": [
          "appIds",
          "appConfigurations",
          "appConfigurationsDigest",
          "installationRepositoriesByIntegration",
          "installationRepositoriesDigest",
          "environmentSecretPlacements",
          "environmentSecretPlacementsDigest",
          "nonEnvironmentGovernanceSecrets",
          "nonEnvironmentGovernanceSecretsDigest",
          "installationTokenProbes",
          "installationTokenProbesDigest"
        ]
      }
    },
    {
      "id": "activate-independent-finalizer-signed-authority",
      "kind": "release-authorization",
      "repository": "ajenchen/design-system",
      "desiredPath": "infra/governance/release-tag-authorization-policy.json",
      "requiredFor": [
        "release",
        "objective-completion"
      ],
      "condition": "Materialize and read back the existing signed release-tag authorization policy for the finalization path. Under PRODUCTION_GRADE_SINGLE_OWNER_SMALL_TEAM, one governed release-tag-authorizer is sufficient and must remain separate from the stage-only OIDC publisher, model, and candidate authority. Under MAXIMUM_ASSURANCE_MULTI_CUSTODIAN_WORM, at least two independently administered authorizers are required. The exact signed authorization remains bound to tag, tag object, commit, tree, registry, policy, TTL, and nonce.",
      "reason": "Finalization signer separation is an engineering trust decision enforced by the existing signed release authorization; multi-custodian quorum is an explicit maximum-assurance control and neither profile depends on a GitHub User/Team approval gate.",
      "evidenceContract": {
        "kind": "signed-operator-bundle",
        "requiredClaimKeys": [
          "allowedKeyIds",
          "quorum",
          "issuerRegistryDigest"
        ]
      }
    },
    {
      "id": "activate-managed-release-trust",
      "kind": "github-repository",
      "repository": "ajenchen/design-system",
      "desiredPath": "infra/governance/desired/github.json#/profiles/design-system-authority",
      "requiredFor": [
        "release",
        "fleet-rollout",
        "objective-completion"
      ],
      "condition": "Readback-align every managed ruleset (including active fleet/immutable-release-tags required_signatures as signed-commit defense-in-depth), required check App ID, protected environment, protected-main workflow identity, and immutable-releases setting; every release ref must independently resolve through the Git Tags API to the same verified signed annotated tag object and exact protected-main commit.",